{"schema_version":"1.1.0","pack_id":"bfa_pack_01","pack_name":"Ashline Courier Drop 01","mode":"pack","theme":{"primary":"off-grid courier"},"style_spine":{"polish":3,"volume":7,"era":7,"status":4,"function":8,"wear":6,"tolerance":1},"palette":{"primary":[{"name":"charcoal","hex":"#2B2B2E"}],"secondary":[],"forbidden":[]},"composition":{"total_items":1},"items":[{"ref":"../../single/ashline_tactical_hoodie.json","id":"bfa_itm_01"}],"fivem":{"resource_name":"ashline_courier_01"}}
